{
 "cam_matrix_world": [
  [
   0.67000812292099,
   -0.6734346151351929,
   0.3123699128627777,
   0.36003756523132324
  ],
  [
   0.7421011328697205,
   0.5966219305992126,
   -0.3054966330528259,
   -0.21803751587867737
  ],
  [
   0.01936527155339718,
   0.436495304107666,
   0.8994981050491333,
   0.4321179687976837
  ],
  [
   0.0,
   0.0,
   0.0,
   1.0
  ]
 ],
 "exposure": -7.891939836930252,
 "seed": 0,
 "variant": "l515",
 "intrinsics": {
  "fx": 451.2015,
  "fy": 451.40150000000006,
  "cx": 325.4805,
  "cy": 182.7205,
  "width": 640,
  "height": 360
 },
 "baseline": null,
 "texture": "checker",
 "wall": false,
 "world": "sky",
 "n_lights": 3,
 "objects": [
  {
   "model": "tree-bath-bomb.obj",
   "plastic": true
  }
 ],
 "n_opaque": 1,
 "camera_dist": 0.4359297444782375,
 "camera_elev_deg": 64.09217648848966,
 "total": 2.593330144882202
}