{
 "cam_matrix_world": [
  [
   -0.981644332408905,
   -0.15669609606266022,
   0.10872317850589752,
   0.39065319299697876
  ],
  [
   0.1903839260339737,
   -0.7712308764457703,
   0.6074182391166687,
   0.5557911992073059
  ],
  [
   -0.011329401284456253,
   0.6169677972793579,
   0.7869068384170532,
   0.5825795531272888
  ],
  [
   0.0,
   0.0,
   0.0,
   1.0
  ]
 ],
 "exposure": -3.8610742185385525,
 "seed": 2,
 "variant": "d435",
 "intrinsics": {
  "fx": 347.9973856787208,
  "fy": 347.9973856787208,
  "cx": 320.0,
  "cy": 180.0,
  "width": 640,
  "height": 360
 },
 "baseline": 0.05,
 "texture": "noise",
 "wall": true,
 "world": "sky",
 "n_lights": 2,
 "objects": [
  {
   "model": "glass-round-potion.obj",
   "plastic": false
  }
 ],
 "n_opaque": 0,
 "camera_dist": 0.6895091815488074,
 "camera_elev_deg": 51.89738496877133,
 "total": 9.204110145568848
}