{
 "cam_matrix_world": [
  [
   -0.37358558177948,
   0.6770250201225281,
   -0.6340906023979187,
   -0.4256436824798584
  ],
  [
   -0.9275954961776733,
   -0.2722245156764984,
   0.25585222244262695,
   0.2191397249698639
  ],
  [
   0.0006033268291503191,
   0.6837623119354248,
   0.7297045588493347,
   0.5287520289421082
  ],
  [
   0.0,
   0.0,
   0.0,
   1.0
  ]
 ],
 "exposure": -7.180615795215405,
 "seed": 1,
 "variant": "d435",
 "intrinsics": {
  "fx": 347.9973856787208,
  "fy": 347.9973856787208,
  "cx": 320.0,
  "cy": 180.0,
  "width": 640,
  "height": 360
 },
 "baseline": 0.05,
 "texture": "checker",
 "wall": false,
 "world": "uniform",
 "n_lights": 3,
 "objects": [
  {
   "model": "star-bath-bomb.obj",
   "plastic": false
  },
  {
   "model": "flower-bath-bomb.obj",
   "plastic": false
  },
  {
   "model": "glass-square-potion.obj",
   "plastic": false
  },
  {
   "model": "square-plastic-bottle.obj",
   "plastic": true
  }
 ],
 "n_opaque": 0,
 "camera_dist": 0.669794332200931,
 "camera_elev_deg": 46.86163592257381,
 "total": 8.22157621383667
}